{
  "$schema": "https://json-schema.org/draft/2020-12/schema",
  "type": "object",
  "properties": {
    "$schema": {
      "type": "string",
      "format": "uri",
      "title": "JSON Schema URI",
      "description": "URI of the JSON Schema used to validate this record",
      "example": "https://raw.githubusercontent.com/carrot-foundation/schemas/refs/heads/main/schemas/ipfs/shared/base/base.schema.json"
    },
    "schema": {
      "type": "object",
      "properties": {
        "hash": {
          "type": "string",
          "pattern": "^[a-f0-9]{64}$",
          "title": "Schema Hash",
          "description": "SHA-256 hash of the JSON Schema this record was validated against",
          "examples": [
            "87f633634cc4b02f628685651f0a29b7bfa22a0bd841f725c6772dd00a58d489"
          ]
        },
        "type": {
          "type": "string",
          "const": "Methodology",
          "title": "Methodology Schema Type",
          "description": "Discriminator value identifying this record as a Methodology impact-measurement definition"
        },
        "version": {
          "type": "string",
          "minLength": 1,
          "pattern": "^v?\\d+\\.\\d+\\.\\d+(-[a-zA-Z0-9.-]+)?(\\+[a-zA-Z0-9.-]+)?$",
          "title": "Schema Version",
          "description": "Version of the schema, using semantic versioning",
          "examples": [
            "0.1.0",
            "1.0.0",
            "2.1.3"
          ]
        },
        "ipfs_uri": {
          "type": "string",
          "minLength": 1,
          "pattern": "^ipfs:\\/\\/(?:Qm[1-9A-HJ-NP-Za-km-z]{44}|[bB][a-z2-7]{58,}|[zZ][1-9A-HJ-NP-Za-km-z]{48,})(?:\\/[^\\s]*)?$",
          "title": "Schema IPFS URI",
          "description": "IPFS URI for this JSON Schema when the primary schema URI is unavailable",
          "examples": [
            "ipfs://bafybeigdyrztvzl5cceubvaxob7iqh6f3f7s36c74ojav2xsz2uib2g3vm",
            "ipfs://bafybeihdwdcefgh4dqkjv67uzcmw7ojee6xedzdetojuzjevtenxquvyku"
          ]
        }
      },
      "required": [
        "hash",
        "type",
        "version",
        "ipfs_uri"
      ],
      "additionalProperties": false
    },
    "created_at": {
      "type": "string",
      "format": "date-time",
      "pattern": "^(?:(?:\\d\\d[2468][048]|\\d\\d[13579][26]|\\d\\d0[48]|[02468][048]00|[13579][26]00)-02-29|\\d{4}-(?:(?:0[13578]|1[02])-(?:0[1-9]|[12]\\d|3[01])|(?:0[469]|11)-(?:0[1-9]|[12]\\d|30)|(?:02)-(?:0[1-9]|1\\d|2[0-8])))T(?:(?:[01]\\d|2[0-3]):[0-5]\\d(?::[0-5]\\d(?:\\.\\d+)?)?(?:Z|([+-](?:[01]\\d|2[0-3]):[0-5]\\d)))$",
      "title": "Created At",
      "description": "ISO 8601 creation timestamp for this record",
      "examples": [
        "2024-12-05T11:02:47.000Z"
      ]
    },
    "external_id": {
      "type": "string",
      "format": "uuid",
      "pattern": "^([0-9a-fA-F]{8}-[0-9a-fA-F]{4}-4[0-9a-fA-F]{3}-[89abAB][0-9a-fA-F]{3}-[0-9a-fA-F]{12})$",
      "title": "External ID",
      "description": "UUID v4 identifier linking this IPFS record to its counterpart in the Carrot platform and other consuming systems",
      "examples": [
        "ad44dd3f-f176-4b98-bf78-5ee6e77d0530"
      ]
    },
    "external_url": {
      "type": "string",
      "format": "uri",
      "title": "External URL",
      "description": "URL pointing to external resources",
      "examples": [
        "https://registry.carrot.eco/",
        "https://whitepaper.carrot.eco/"
      ]
    },
    "viewer_reference": {
      "type": "object",
      "properties": {
        "ipfs_uri": {
          "type": "string",
          "minLength": 1,
          "pattern": "^ipfs:\\/\\/(?:Qm[1-9A-HJ-NP-Za-km-z]{44}|[bB][a-z2-7]{58,}|[zZ][1-9A-HJ-NP-Za-km-z]{48,})(?:\\/[^\\s]*)?$",
          "title": "Viewer IPFS URI",
          "description": "IPFS URI of the metadata viewer dApp build",
          "examples": [
            "ipfs://bafybeigdyrztvzl5cceubvaxob7iqh6f3f7s36c74ojav2xsz2uib2g3vm",
            "ipfs://bafybeihdwdcefgh4dqkjv67uzcmw7ojee6xedzdetojuzjevtenxquvyku"
          ]
        }
      },
      "required": [
        "ipfs_uri"
      ],
      "additionalProperties": false,
      "title": "Metadata Viewer Reference",
      "description": "Immutable reference to the metadata viewer dApp build. The IPFS CID itself is the integrity proof: tampered content resolves to a different CID"
    },
    "environment": {
      "type": "object",
      "properties": {
        "blockchain_network": {
          "type": "string",
          "enum": [
            "mainnet",
            "testnet"
          ],
          "title": "Blockchain Network",
          "description": "Blockchain network where this record is deployed"
        },
        "deployment": {
          "type": "string",
          "enum": [
            "production",
            "development",
            "testing"
          ],
          "title": "Deployment Environment",
          "description": "System environment where this record was generated"
        },
        "data_set_name": {
          "type": "string",
          "enum": [
            "TEST",
            "PROD"
          ],
          "title": "Data Set Name",
          "description": "Name of the data set for this record"
        }
      },
      "required": [
        "blockchain_network",
        "deployment",
        "data_set_name"
      ],
      "additionalProperties": false,
      "title": "Record Environment",
      "description": "Environment information for the record"
    },
    "data": {
      "type": "object",
      "properties": {
        "name": {
          "type": "string",
          "enum": [
            "AMS-III.F. | BOLD Carbon (CH₄) - SSC",
            "AMS-III.F. | BOLD Recycling Credit"
          ],
          "title": "Methodology Name",
          "description": "Full official name of the methodology",
          "examples": [
            "AMS-III.F. | BOLD Carbon (CH₄) - SSC",
            "AMS-III.F. | BOLD Recycling Credit"
          ]
        },
        "short_name": {
          "type": "string",
          "enum": [
            "BOLD Carbon (CH₄)",
            "BOLD Recycling"
          ],
          "title": "Methodology Short Name",
          "description": "Abbreviated/short name of the methodology used for UI display and references",
          "examples": [
            "BOLD Carbon (CH₄)",
            "BOLD Recycling"
          ]
        },
        "slug": {
          "type": "string",
          "enum": [
            "bold-recycling",
            "bold-carbon-ch4"
          ],
          "title": "Methodology Slug",
          "description": "URL-friendly identifier for the methodology",
          "examples": [
            "bold-recycling",
            "bold-carbon-ch4"
          ]
        },
        "version": {
          "type": "string",
          "minLength": 1,
          "pattern": "^v?\\d+\\.\\d+\\.\\d+(-[a-zA-Z0-9.-]+)?(\\+[a-zA-Z0-9.-]+)?$",
          "title": "Methodology Version",
          "description": "Semantic version of this methodology revision (e.g., 1.0.0)",
          "examples": [
            "0.1.0",
            "1.0.0",
            "2.1.3"
          ]
        },
        "description": {
          "type": "string",
          "minLength": 50,
          "maxLength": 2000,
          "title": "Methodology Description",
          "description": "Comprehensive methodology description including purpose, scope, and implementation approach"
        },
        "revision_date": {
          "type": "string",
          "format": "date",
          "pattern": "^(?:(?:\\d\\d[2468][048]|\\d\\d[13579][26]|\\d\\d0[48]|[02468][048]00|[13579][26]00)-02-29|\\d{4}-(?:(?:0[13578]|1[02])-(?:0[1-9]|[12]\\d|3[01])|(?:0[469]|11)-(?:0[1-9]|[12]\\d|30)|(?:02)-(?:0[1-9]|1\\d|2[0-8])))$",
          "title": "Revision Date",
          "description": "ISO 8601 date of the last revision to this methodology",
          "examples": [
            "2024-12-05"
          ]
        },
        "publication_date": {
          "type": "string",
          "format": "date",
          "pattern": "^(?:(?:\\d\\d[2468][048]|\\d\\d[13579][26]|\\d\\d0[48]|[02468][048]00|[13579][26]00)-02-29|\\d{4}-(?:(?:0[13578]|1[02])-(?:0[1-9]|[12]\\d|3[01])|(?:0[469]|11)-(?:0[1-9]|[12]\\d|30)|(?:02)-(?:0[1-9]|1\\d|2[0-8])))$",
          "title": "Publication Date",
          "description": "ISO 8601 date of the original publication of this methodology",
          "examples": [
            "2024-12-05"
          ]
        },
        "methodology_pdf": {
          "type": "string",
          "minLength": 1,
          "pattern": "^ipfs:\\/\\/(?:Qm[1-9A-HJ-NP-Za-km-z]{44}|[bB][a-z2-7]{58,}|[zZ][1-9A-HJ-NP-Za-km-z]{48,})(?:\\/[^\\s]*)?$",
          "title": "Methodology PDF",
          "description": "IPFS URI pointing to the complete methodology PDF document",
          "examples": [
            "ipfs://bafybeigdyrztvzl5cceubvaxob7iqh6f3f7s36c74ojav2xsz2uib2g3vm",
            "ipfs://bafybeihdwdcefgh4dqkjv67uzcmw7ojee6xedzdetojuzjevtenxquvyku"
          ]
        },
        "mass_id_audit_rules": {
          "minItems": 1,
          "type": "array",
          "items": {
            "type": "object",
            "properties": {
              "id": {
                "type": "string",
                "format": "uuid",
                "pattern": "^([0-9a-fA-F]{8}-[0-9a-fA-F]{4}-4[0-9a-fA-F]{3}-[89abAB][0-9a-fA-F]{3}-[0-9a-fA-F]{12})$",
                "title": "Rule ID",
                "description": "Unique identifier for the audit rule",
                "examples": [
                  "ad44dd3f-f176-4b98-bf78-5ee6e77d0530"
                ]
              },
              "slug": {
                "type": "string",
                "minLength": 1,
                "maxLength": 100,
                "pattern": "^[a-z0-9-]+$",
                "title": "Rule Slug",
                "description": "URL-friendly identifier for the rule",
                "examples": [
                  "mass-id-123",
                  "recycled-plastic",
                  "organic-waste"
                ]
              },
              "name": {
                "type": "string",
                "minLength": 1,
                "maxLength": 100,
                "title": "Rule Name",
                "description": "Human-readable name of the rule",
                "examples": [
                  "Waste Mass is Unique",
                  "No Conflicting GasID or Credit"
                ]
              },
              "description": {
                "type": "string",
                "minLength": 10,
                "maxLength": 500,
                "title": "Rule Description",
                "description": "Detailed description of what the rule validates and why it is necessary",
                "examples": [
                  "Validates that each MassID is unique within the system to prevent duplicate entries"
                ]
              },
              "source_code_url": {
                "type": "string",
                "pattern": "^https:\\/\\/github\\.com\\/.*$",
                "title": "Rule Source Code URL",
                "description": "GitHub URL pointing to the implementation source code for this rule",
                "examples": [
                  "https://github.com/carrot-foundation/methodologies/blob/main/bold-carbon/rules/waste-mass-unique.js"
                ]
              },
              "execution_order": {
                "type": "integer",
                "minimum": 1,
                "maximum": 9007199254740991,
                "title": "Rule Execution Order",
                "description": "Sequential order in which this rule must be executed",
                "examples": [
                  1,
                  123,
                  456
                ]
              }
            },
            "required": [
              "id",
              "slug",
              "name",
              "description",
              "source_code_url",
              "execution_order"
            ],
            "additionalProperties": false,
            "title": "Audit Rule Definition",
            "description": "Definition of an audit rule that must be executed for methodology compliance"
          },
          "title": "MassID Audit Rules",
          "description": "Audit rules that must be executed to check MassID compliance with the methodology"
        }
      },
      "required": [
        "name",
        "short_name",
        "slug",
        "version",
        "description",
        "revision_date",
        "publication_date",
        "methodology_pdf",
        "mass_id_audit_rules"
      ],
      "additionalProperties": false,
      "title": "Methodology Data",
      "description": "Methodology definition including name, version, documentation, and audit rules"
    }
  },
  "required": [
    "$schema",
    "schema",
    "created_at",
    "external_id",
    "external_url",
    "data"
  ],
  "additionalProperties": false,
  "title": "Methodology IPFS Record",
  "description": "Methodology metadata stored in IPFS, defining the environmental impact measurement approach including versioning, documentation, and MassID audit rules",
  "$id": "https://raw.githubusercontent.com/carrot-foundation/schemas/refs/tags/v5.1.1/schemas/ipfs/methodology/methodology.schema.json",
  "version": "5.1.1"
}
